{
  "$schema": "../../../docs/schemas/character-asset-manifest.schema.json",
  "schemaVersion": 1,
  "assetFamily": "blood-league-humanoid-v1",
  "runtime": {
    "character": "public/assets/vendor/quaternius/night-striker.glb",
    "animations": "public/assets/vendor/quaternius/universal-animation-library.glb",
    "fallback": "procedural humanoid",
    "runtimeYawRadians": 3.141592653589793,
    "worldPositionOwner": "simulation"
  },
  "coordinateContract": {
    "units": "meters",
    "upAxis": "+Y",
    "authoredForwardAxis": "+Z",
    "gameplayForwardAxis": "-Z",
    "feetAtY": 0,
    "feetToleranceMeters": 0.02,
    "identitySceneRootTransform": true,
    "rootMotion": false
  },
  "skeleton": {
    "sceneRoot": "Armature",
    "skinName": "Armature",
    "jointCount": 65,
    "joints": [
      "root",
      "pelvis",
      "spine_01",
      "spine_02",
      "spine_03",
      "neck_01",
      "Head",
      "clavicle_l",
      "upperarm_l",
      "lowerarm_l",
      "hand_l",
      "index_01_l",
      "index_02_l",
      "index_03_l",
      "index_04_leaf_l",
      "middle_01_l",
      "middle_02_l",
      "middle_03_l",
      "middle_04_leaf_l",
      "pinky_01_l",
      "pinky_02_l",
      "pinky_03_l",
      "pinky_04_leaf_l",
      "ring_01_l",
      "ring_02_l",
      "ring_03_l",
      "ring_04_leaf_l",
      "thumb_01_l",
      "thumb_02_l",
      "thumb_03_l",
      "thumb_04_leaf_l",
      "clavicle_r",
      "upperarm_r",
      "lowerarm_r",
      "hand_r",
      "index_01_r",
      "index_02_r",
      "index_03_r",
      "index_04_leaf_r",
      "middle_01_r",
      "middle_02_r",
      "middle_03_r",
      "middle_04_leaf_r",
      "pinky_01_r",
      "pinky_02_r",
      "pinky_03_r",
      "pinky_04_leaf_r",
      "ring_01_r",
      "ring_02_r",
      "ring_03_r",
      "ring_04_leaf_r",
      "thumb_01_r",
      "thumb_02_r",
      "thumb_03_r",
      "thumb_04_leaf_r",
      "thigh_l",
      "calf_l",
      "foot_l",
      "ball_l",
      "ball_leaf_l",
      "thigh_r",
      "calf_r",
      "foot_r",
      "ball_r",
      "ball_leaf_r"
    ],
    "attachmentJoints": {
      "head": "Head",
      "leftHand": "hand_l",
      "rightHand": "hand_r",
      "leftBoot": "foot_l",
      "rightBoot": "foot_r"
    }
  },
  "shippingGate": {
    "characterMaxBytes": 6800000,
    "animationMaxBytes": 3000000,
    "maxTriangles": 15000,
    "maxMaterials": 4,
    "maxTextures": 8,
    "maxTextureDimension": 1024,
    "maxGpuTextureBytes": 32000000,
    "maxCharacterHeightMeters": 1.9,
    "maxSceneCount": 1,
    "maxSkinCount": 1,
    "allowCameras": false,
    "allowLights": false
  },
  "productionTarget": {
    "characterMaxBytes": 2500000,
    "maxGpuTextureBytes": 12000000,
    "textureFormat": "KTX2",
    "distantLodTriangleRatio": 0.45,
    "sharedMaterialSlots": ["skin", "hair", "eyes", "kit", "boots", "accessory"]
  },
  "runtimeRequiredClips": ["Idle_Loop", "Jog_Fwd_Loop", "Sprint_Loop", "Roll", "Punch_Cross"],
  "productionAnimationSlots": [
    { "slot": "idle", "clip": "Idle_Loop", "status": "usable" },
    { "slot": "jog", "clip": "Jog_Fwd_Loop", "status": "usable" },
    { "slot": "sprint", "clip": "Sprint_Loop", "status": "usable" },
    { "slot": "dribble", "clip": null, "status": "missing" },
    { "slot": "strafeLeft", "clip": null, "status": "missing" },
    { "slot": "strafeRight", "clip": null, "status": "missing" },
    { "slot": "groundPass", "clip": null, "status": "missing" },
    { "slot": "lobPass", "clip": null, "status": "missing" },
    { "slot": "shoot", "clip": "Punch_Cross", "status": "placeholder" },
    { "slot": "heading", "clip": null, "status": "missing" },
    { "slot": "slideTackle", "clip": "Roll", "status": "placeholder" },
    { "slot": "bicycleKick", "clip": "Roll", "status": "placeholder" },
    { "slot": "damage", "clip": "Hit_Chest", "status": "usable" },
    { "slot": "knockdown", "clip": "Death01", "status": "placeholder" },
    { "slot": "celebration", "clip": "Dance_Loop", "status": "usable" },
    { "slot": "victory", "clip": "Dance_Loop", "status": "placeholder" },
    { "slot": "defeat", "clip": "Death01", "status": "usable" }
  ],
  "variants": [
    {
      "id": "maestro",
      "bodyProfile": "lean-balanced",
      "headProfile": "angular",
      "hairProfile": "swept",
      "accessory": "captain-armband"
    },
    {
      "id": "breakaway",
      "bodyProfile": "compact-sprinter",
      "headProfile": "diamond",
      "hairProfile": "high-fade",
      "accessory": "speed-tape"
    },
    {
      "id": "tower",
      "bodyProfile": "tall-power",
      "headProfile": "broad",
      "hairProfile": "close-crop",
      "accessory": "shoulder-guard"
    },
    {
      "id": "finisher",
      "bodyProfile": "sharp-athletic",
      "headProfile": "heart",
      "hairProfile": "undercut",
      "accessory": "fang-collar"
    },
    {
      "id": "engine",
      "bodyProfile": "endurance-athletic",
      "headProfile": "oval",
      "hairProfile": "braided",
      "accessory": "wrist-wraps"
    },
    {
      "id": "guardian",
      "bodyProfile": "stocky-defender",
      "headProfile": "square",
      "hairProfile": "short-coils",
      "accessory": "forearm-guards"
    }
  ],
  "variantCompatibility": {
    "requiredVariantIds": ["maestro", "breakaway", "tower", "finisher", "engine", "guardian"],
    "sharedSkeleton": true,
    "sharedBindPose": true,
    "sharedAnimationLibrary": true,
    "meshMayVary": true,
    "jointNamesMayVary": false,
    "jointOrderMayVary": false,
    "sceneRootTransformMayVary": false,
    "accessoriesMustBeSeparateMeshes": true,
    "status": "contract-ready-assets-pending"
  }
}
